[
  {
    "id": "Q-D1-0909",
    "domain": 1,
    "task_statement": "1.1",
    "type": "single_choice",
    "difficulty": "easy",
    "theory_refs": ["TH-D1-001"],
    "case_study_id": null,
    "stem": "A developer wants to compose a prompt template, a chat model, and an output parser into a single pipeline using the pipe operator. Which LangChain interface enables this composition?",
    "select_count": 1,
    "options": [
      { "key": "A", "text": "The Runnable interface via LCEL" },
      { "key": "B", "text": "A plain Python function" },
      { "key": "C", "text": "A vector store retriever" }
    ],
    "correct": ["A"],
    "explanation": {
      "why_correct": "LCEL composes any Runnable (prompts, models, parsers) using the pipe operator because they all share the same Runnable interface with invoke/batch/stream methods.",
      "why_incorrect": {
        "B": "A plain Python function does not implement the Runnable interface unless wrapped, so it cannot be piped directly without conversion.",
        "C": "A retriever is itself a Runnable but is not what enables composition generally; it's just one example of a Runnable."
      },
      "rule_of_thumb": "If you can chain it with the pipe operator, it's because it implements the Runnable interface."
    },
    "tags": ["fixture"]
  },
  {
    "id": "Q-D1-0910",
    "domain": 1,
    "task_statement": "1.1",
    "type": "single_choice",
    "difficulty": "easy",
    "theory_refs": ["TH-D1-001"],
    "case_study_id": null,
    "stem": "A programmer wants to compose a prompt template, a chat model, and an output parser into a single pipeline using the pipe operator. Which LangChain interface enables this composition?",
    "select_count": 1,
    "options": [
      { "key": "A", "text": "The Runnable interface via LCEL" },
      { "key": "B", "text": "A plain Python function" },
      { "key": "C", "text": "A vector store retriever" }
    ],
    "correct": ["A"],
    "explanation": {
      "why_correct": "LCEL composes any Runnable (prompts, models, parsers) using the pipe operator because they all share the same Runnable interface with invoke/batch/stream methods.",
      "why_incorrect": {
        "B": "A plain Python function does not implement the Runnable interface unless wrapped, so it cannot be piped directly without conversion.",
        "C": "A retriever is itself a Runnable but is not what enables composition generally; it's just one example of a Runnable."
      },
      "rule_of_thumb": "If you can chain it with the pipe operator, it's because it implements the Runnable interface."
    },
    "tags": ["fixture"]
  }
]
